{
  "id": "0.3.3",
  "title": "The Rome and Late Antiquity shelf takes shape",
  "date": "2026-07-25",
  "summary": "Thirty-three Roman and late-antique texts arrive clean, history enters the library, the Grand Tour gains its second section — and the reader learns to tell you where you are.",
  "filename": "entry.md"
}
